{
  "id": "01jrcasebox00000000000ep03",
  "tenant_id": "tenant-local-v1",
  "actor_user_id": "local-user",
  "matter_id": "01jrcasebox0000000000000m1",
  "claim_track_id": "01jrcasebox0000000000000t1",
  "evidence_id": "01jrcasebox0000000000000e9",
  "submitted_by_side": "opposing_side",
  "evidence_purpose": "Opposing exhibit used on the main claim.",
  "facts_to_prove": ["Opposing party admits receipt of the demand letter."],
  "trial_use_summary": "Use in cross to establish notice.",
  "key_page": 1,
  "key_page_note": null,
  "review_status": "in_review",
  "sort_order": 2,
  "created_at": "2026-07-16T09:10:00.000Z",
  "updated_at": "2026-07-16T09:10:00.000Z"
}
