{
  "id": "01jrcasebox00000000000ep01",
  "tenant_id": "tenant-local-v1",
  "actor_user_id": "local-user",
  "matter_id": "01jrcasebox0000000000000m1",
  "claim_track_id": "01jrcasebox0000000000000t1",
  "evidence_id": "01jrcasebox0000000000000e1",
  "submitted_by_side": "our_side",
  "evidence_purpose": "Establishes the counterparty received and signed the supply agreement.",
  "facts_to_prove": [
    "The supply agreement was executed on 2026-01-10.",
    "The counterparty accepted delivery terms in clause 4."
  ],
  "trial_use_summary": "Introduce during examination-in-chief to anchor the contract-formation timeline.",
  "key_page": 5,
  "key_page_note": "Signature block at the foot of page 5.",
  "review_status": "confirmed",
  "sort_order": 0,
  "created_at": "2026-07-16T09:00:00.000Z",
  "updated_at": "2026-07-16T09:00:00.000Z"
}
